{
  "schema": "pose.v1",
  "analysisId": "0704ac13-84e7-4f22-93a6-2734dec48192",
  "client": {
    "app": "0.0.0",
    "build": "0",
    "os": "synthetic",
    "device": "synthetic",
    "poseApi": "synthetic",
    "algo": "gen-synthetic-pose-1"
  },
  "session": {
    "sport": "badminton",
    "skill": "bd.clear_fh",
    "handedness": "right",
    "level": "beginner",
    "cameraView": "side",
    "subject": "self",
    "subjectConsent": false,
    "subjectMinor": false,
    "language": "vi"
  },
  "video": {
    "source": "recorded",
    "durationMs": 12346,
    "segment": {
      "startMs": 1000,
      "endMs": 11346
    },
    "srcFps": 30,
    "analysisHz": 30,
    "display": {
      "w": 1920,
      "h": 1080
    },
    "mirrored": true
  },
  "quality": {
    "framesTotal": 308,
    "framesWithTarget": 308,
    "meanLimbConf": 0.825,
    "playerHeightFrac": 0.6,
    "trackResets": 0,
    "ambiguousAtMs": []
  },
  "track": {
    "jointOrder": ["nose", "lEye", "rEye", "lEar", "rEar", "neck", "lSho", "rSho", "lElb", "rElb", "lWri", "rWri", "root", "lHip", "rHip", "lKne", "rKne", "lAnk", "rAnk"],
    "tUs": [1000000, 1032721, 1067169, 1100047, 1130943, 1165102, 1199535, 1230727, 1264186, 1297795, 1331823, 1366087, 1399936, 1435554, 1466865, 1499918, 1530828, 1567120, 1599850, 1634622, 1665565, 1699892, 1733146, 1767033, 1800540, 1835546, 1865799, 1897723, 1931114, 1966573, 2002022, 2031040, 2067447, 2100706, 2133328, 2165661, 2198151, 2232456, 2265530, 2298389, 2335757, 2368055, 2399215, 2431474, 2468193, 2500834, 2530876, 2569125, 2601473, 2632861, 2664052, 2699496, 2731125, 2768700, 2801543, 2833317, 2864597, 2899376, 2931815, 2964028, 2997644, 3032030, 3065670, 3098531, 3133045, 3165802, 3198171, 3232612, 3267987, 3301612, 3334859, 3365337, 3398224, 3432312, 3464244, 3502249, 3531928, 3566687, 3602257, 3631541, 3664450, 3700156, 3734447, 3767226, 3798794, 3831925, 3868528, 3902661, 3934405, 3966586, 4000139, 4032123, 4064702, 4101099, 4133989, 4165162, 4201616, 4233674, 4265808, 4298256, 4333963, 4368528, 4401794, 4431375, 4466441, 4500255, 4531169, 4567585, 4600912, 4631190, 4666900, 4697848, 4732895, 4768945, 4797712, 4833779, 4867534, 4901446, 4932354, 4967465, 4997891, 5032998, 5068358, 5101051, 5135088, 5164914, 5201453, 5231147, 5267086, 5301633, 5333898, 5368662, 5400813, 5434238, 5468257, 5497798, 5534169, 5566602, 5598857, 5631200, 5668564, 5702023, 5735463, 5767158, 5799057, 5834821, 5864772, 5899113, 5935606, 5965078, 6000361, 6033208, 6065379, 6100374, 6132814, 6167278, 6201452, 6235794, 6268727, 6299120, 6332955, 6364447, 6400651, 6432160, 6466847, 6497676, 6531771, 6567252, 6599606, 6635430, 6666008, 6698785, 6734657, 6766458, 6800259, 6830869, 6866787, 6899667, 6931332, 6964444, 7002532, 7031534, 7067895, 7099222, 7133513, 7164599, 7197621, 7232076, 7264784, 7301088, 7335128, 7364457, 7398391, 7434332, 7467477, 7502495, 7533496, 7566096, 7602474, 7634795, 7668572, 7699599, 7732314, 7768616, 7801679, 7832296, 7867326, 7900337, 7934118, 7968470, 7999661, 8034416, 8066718, 8100142, 8132719, 8165423, 8201512, 8231290, 8265641, 8297717, 8330698, 8366570, 8399769, 8431692, 8465003, 8500401, 8533516, 8567688, 8601931, 8635324, 8667006, 8700128, 8731360, 8767928, 8802613, 8832302, 8867493, 8897752, 8933412, 8964040, 9001503, 9035021, 9068037, 9097668, 9131998, 9164747, 9198259, 9234907, 9265163, 9302158, 9332937, 9364768, 9397852, 9430682, 9467635, 9501008, 9535442, 9564568, 9601638, 9635466, 9668838, 9698720, 9733770, 9764587, 9802578, 9830910, 9865224, 9899280, 9935058, 9964765, 9998560, 10034715, 10066691, 10099544, 10135073, 10165053, 10202274, 10233652, 10266981, 10300286, 10332552, 10432559, 10468200, 10500347, 10535316, 10567095, 10597507, 10635281, 10666310, 10701521, 10735379, 10767842, 10797573, 10831872, 10868237, 10901902, 10935813, 10966855, 10999741, 11035267, 11066163, 11098740, 11131871, 11167286, 11198420, 11234056, 11268750, 11298499],
    "kp": [
      [466, 378, 85, 471, 365, 77, 468, 361, 67, 491, 369, 60, 485, 368, 67, 488, 427, 78, 494, 443, 76, 484, 444, 88, 458, 530, 85, 453, 543, 77, 397, 508, 64, 407, 602, 72, 503, 608, 95, 502, 610, 86, 496, 612, 81, 501, 756, 90, 463, 758, 80, 537, 910, 94, 462, 913, 90],
      [464, 377, 99, 467, 365, 73, 469, 362, 51, 485, 366, 63, 485, 369, 73, 489, 428, 87, 497, 444, 99, 483, 444, 78, 460, 528, 78, 454, 542, 80, 401, 506, 82, 405, 615, 64, 499, 606, 81, 502, 607, 60, 496, 603, 70, 499, 759, 73, 461, 759, 70, 536, 907, 67, 466, 910, 77],
      [464, 380, 71, 468, 361, 63, 467, 359, 80, 487, 366, 79, 482, 366, 79, 487, 426, 90, 492, 441, 89, 485, 446, 94, 457, 526, 99, 450, 542, 88, 394, 511, 63, 409, 603, 68, 498, 606, 83, 503, 602, 97, 496, 608, 91, 500, 762, 83, 459, 763, 64, 535, 905, 97, 463, 907, 77],
      [461, 372, 77, 467, 366, 67, 464, 364, 65, 486, 366, 51, 482, 364, 60, 487, 428, 97, 495, 441, 97, 481, 448, 98, 453, 524, 87, 451, 543, 90, 398, 507, 90, 407, 605, 62, 498, 604, 72, 502, 610, 81, 492, 602, 87, 501, 757, 76, 0, 0, 0, 535, 913, 82, 464, 915, 93],
      [463, 375, 97, 469, 366, 67, 466, 363, 71, 486, 366, 66, 484, 369, 63, 485, 427, 80, 494, 439, 99, 483, 447, 90, 453, 527, 88, 449, 536, 80, 402, 513, 72, 405, 615, 65, 498, 605, 82, 501, 610, 77, 493, 606, 84, 497, 754, 73, 0, 0, 0, 533, 910, 99, 461, 915, 84],
      [464, 375, 72, 466, 364, 58, 465, 360, 60, 484, 366, 79, 481, 365, 66, 485, 427, 72, 492, 445, 71, 478, 448, 88, 454, 526, 81, 448, 540, 85, 394, 512, 70, 402, 606, 66, 498, 610, 89, 500, 608, 92, 494, 603, 89, 499, 757, 73, 0, 0, 0, 531, 909, 87, 462, 915, 90],
      [460, 376, 65, 465, 365, 59, 464, 362, 69, 484, 364, 63, 482, 367, 58, 485, 422, 92, 492, 442, 90, 480, 442, 80, 452, 526, 88, 450, 544, 92, 396, 514, 69, 403, 610, 65, 497, 604, 94, 503, 602, 88, 491, 609, 85, 498, 757, 83, 456, 757, 88, 531, 908, 80, 463, 912, 89],
      [458, 382, 84, 466, 363, 77, 462, 367, 64, 484, 368, 63, 483, 365, 66, 484, 423, 88, 493, 442, 85, 482, 441, 83, 452, 531, 99, 450, 543, 90, 390, 504, 79, 402, 609, 77, 497, 603, 85, 502, 603, 87, 491, 607, 82, 497, 760, 78, 457, 763, 86, 532, 906, 87, 463, 909, 83],
      [459, 377, 66, 464, 360, 71, 463, 362, 69, 484, 366, 53, 481, 365, 63, 487, 427, 80, 491, 438, 71, 480, 444, 87, 452, 529, 84, 446, 545, 68, 395, 517, 66, 404, 612, 58, 496, 603, 93, 500, 609, 90, 0, 0, 0, 495, 757, 99, 458, 759, 91, 530, 911, 97, 461, 912, 76],
      [461, 376, 93, 466, 360, 59, 463, 364, 60, 482, 369, 66, 480, 361, 65, 484, 424, 92, 492, 442, 79, 481, 448, 99, 451, 532, 99, 450, 540, 89, 393, 507, 81, 403, 611, 76, 494, 606, 82, 500, 602, 93, 489, 612, 86, 497, 757, 66, 457, 762, 89, 530, 909, 89, 462, 914, 90],
      [459, 382, 82, 463, 359, 77, 461, 362, 65, 484, 365, 65, 480, 364, 60, 484, 427, 80, 491, 442, 85, 478, 442, 83, 448, 526, 89, 445, 542, 91, 391, 507, 72, 402, 608, 74, 493, 607, 73, 496, 606, 73, 490, 602, 98, 496, 756, 88, 455, 762, 98, 528, 917, 86, 458, 909, 60],
      [457, 378, 91, 463, 364, 63, 458, 361, 65, 481, 365, 57, 477, 367, 55, 483, 424, 78, 491, 440, 81, 478, 445, 76, 451, 527, 91, 445, 543, 75, 388, 513, 63, 402, 605, 82, 492, 606, 77, 498, 606, 75, 489, 604, 81, 498, 758, 99, 454, 756, 87, 529, 913, 70, 458, 910, 93],
      [457, 379, 99, 463, 360, 63, 463, 362, 63, 481, 366, 66, 478, 369, 59, 484, 430, 84, 491, 443, 83, 478, 443, 79, 448, 530, 99, 447, 541, 94, 389, 505, 71, 401, 612, 73, 492, 604, 77, 497, 606, 90, 491, 602, 84, 495, 759, 70, 452, 756, 90, 526, 911, 78, 457, 912, 88],
      [457, 376, 90, 459, 363, 69, 463, 362, 59, 480, 366, 62, 476, 371, 80, 484, 431, 78, 490, 446, 88, 478, 445, 83, 446, 529, 68, 447, 542, 92, 391, 505, 61, 405, 613, 61, 491, 600, 89, 496, 604, 71, 488, 608, 76, 494, 758, 87, 453, 760, 90, 526, 911, 77, 457, 914, 70],
      [454, 380, 79, 464, 360, 74, 460, 361, 48, 480, 361, 70, 477, 363, 80, 482, 425, 84, 489, 444, 96, 477, 444, 97, 444, 530, 72, 445, 545, 97, 389, 510, 81, 401, 612, 66, 493, 608, 84, 496, 603, 81, 487, 607, 95, 491, 757, 83, 452, 759, 79, 527, 911, 83, 455, 913, 88],
      [454, 376, 94, 461, 367, 58, 458, 362, 74, 479, 366, 68, 475, 365, 54, 481, 426, 88, 486, 440, 79, 477, 441, 81, 447, 527, 94, 443, 542, 68, 388, 508, 73, 400, 610, 77, 492, 605, 88, 494, 607, 86, 488, 605, 91, 494, 757, 78, 454, 755, 74, 527, 913, 85, 458, 910, 93],
      [451, 375, 77, 460, 359, 66, 461, 363, 63, 480, 372, 67, 476, 367, 60, 478, 428, 78, 486, 449, 77, 476, 445, 88, 449, 530, 83, 443, 540, 96, 393, 509, 78, 400, 604, 76, 491, 605, 75, 495, 607, 76, 488, 605, 88, 491, 757, 88, 452, 756, 91, 528, 908, 90, 454, 911, 82],
      [455, 377, 67, 462, 362, 53, 457, 363, 74, 477, 361, 75, 474, 370, 62, 480, 421, 87, 484, 444, 78, 476, 442, 79, 447, 526, 95, 445, 544, 86, 387, 511, 71, 400, 608, 64, 492, 605, 76, 494, 608, 82, 487, 604, 84, 491, 757, 77, 453, 757, 87, 528, 913, 80, 455, 912, 83],
      [452, 372, 87, 460, 367, 91, 455, 356, 70, 479, 367, 60, 475, 366, 61, 478, 425, 86, 487, 443, 82, 474, 449, 98, 447, 530, 86, 444, 544, 92, 385, 510, 73, 399, 610, 67, 491, 606, 92, 493, 604, 83, 485, 601, 90, 489, 756, 86, 0, 0, 0, 523, 910, 88, 456, 912, 79],
      [451, 381, 86, 460, 364, 54, 457, 363, 56, 477, 369, 75, 474, 366, 80, 480, 425, 89, 486, 442, 93, 473, 447, 99, 443, 529, 96, 443, 547, 82, 392, 511, 70, 398, 606, 62, 491, 605, 84, 491, 607, 82, 486, 605, 86, 492, 756, 84, 0, 0, 0, 524, 913, 87, 454, 913, 82],
      [455, 376, 75, 458, 360, 68, 454, 362, 62, 476, 370, 68, 474, 360, 73, 475, 427, 85, 485, 446, 83, 474, 440, 99, 446, 529, 81, 442, 539, 91, 388, 511, 63, 396, 610, 76, 489, 599, 83, 491, 605, 89, 483, 603, 85, 489, 760, 93, 0, 0, 0, 526, 911, 90, 452, 912, 89],
      [451, 379, 87, 460, 366, 53, 455, 359, 44, 474, 370, 65, 475, 370, 70, 475, 420, 84, 487, 442, 93, 471, 451, 90, 446, 524, 86, 441, 542, 83, 387, 510, 79, 397, 615, 74, 488, 605, 76, 493, 604, 96, 483, 603, 73, 489, 758, 80, 449, 760, 84, 525, 915, 99, 452, 906, 89],